"Apptrian Extensions","Apptrian Extensions"
"Examples with <strong>contents</strong>:<br /><br /><strong>Product SKU</strong><br />contents: [<br />{id: 'SHBP', quantity: 1}<br />]<br /><br /><strong>Children SKUs</strong><br />contents: [<br />{id: 'SHBP-6-BL', quantity: 1},<br />{id: 'SHBP-7-BL', quantity: 1},<br />{id: 'SHBP-8-BL', quantity: 1}<br />]<br /><br /><strong>Children SKUs and Product SKU</strong><br />contents: [<br />{id: 'SHBP-6-BL', item_group_id: 'SHBP', quantity: 1},<br />{id: 'SHBP-7-BL', item_group_id: 'SHBP', quantity: 1},<br />{id: 'SHBP-8-BL', item_group_id: 'SHBP', quantity: 1}<br />]<br /><br/ >Examples with <strong>content_ids</strong>:<br /><br /><strong>Product SKU</strong><br />content_ids: ['SHBP']<br /><br /><strong>Children SKUs</strong><br />content_ids: ['SHBP-6-BL', 'SHBP-7-BL', 'SHBP-8-BL']<br /><br /><strong>Children SKUs and Product SKU</strong><br />content_ids: ['SHBP-6-BL', 'SHBP-7-BL', 'SHBP-8-BL'],<br />item_group_id: 'SHBP'<br /><br />The <strong>Product SKU</strong> option is not recommended because of the nature of grouped products in Magento. From Magento documentation: ""Although they are presented as a group, each product in the group is purchased as a separate item. In the shopping cart, each item and the quantity purchased appears as a separate line item.""","Examples with <strong>contents</strong>:<br /><br /><strong>Product SKU</strong><br />contents: [<br />{id: 'SHBP', quantity: 1}<br />]<br /><br /><strong>Children SKUs</strong><br />contents: [<br />{id: 'SHBP-6-BL', quantity: 1},<br />{id: 'SHBP-7-BL', quantity: 1},<br />{id: 'SHBP-8-BL', quantity: 1}<br />]<br /><br /><strong>Children SKUs and Product SKU</strong><br />contents: [<br />{id: 'SHBP-6-BL', item_group_id: 'SHBP', quantity: 1},<br />{id: 'SHBP-7-BL', item_group_id: 'SHBP', quantity: 1},<br />{id: 'SHBP-8-BL', item_group_id: 'SHBP', quantity: 1}<br />]<br /><br/ >Examples with <strong>content_ids</strong>:<br /><br /><strong>Product SKU</strong><br />content_ids: ['SHBP']<br /><br /><strong>Children SKUs</strong><br />content_ids: ['SHBP-6-BL', 'SHBP-7-BL', 'SHBP-8-BL']<br /><br /><strong>Children SKUs and Product SKU</strong><br />content_ids: ['SHBP-6-BL', 'SHBP-7-BL', 'SHBP-8-BL'],<br />item_group_id: 'SHBP'<br /><br />The <strong>Product SKU</strong> option is not recommended because of the nature of grouped products in Magento. From Magento documentation: ""Although they are presented as a group, each product in the group is purchased as a separate item. In the shopping cart, each item and the quantity purchased appears as a separate line item."""
"Use product_group Instead of product (Grouped)","Use product_group Instead of product (Grouped)"
"This option shoud be set to ""No"".<br />There is only one scenario when this option should be set to ""Yes"". That is when you select <strong>Product SKU</strong> for option <strong>For Grouped Products Use</strong>. Regarding <strong>content_type</strong> read this from Facebook documentation: ""If the IDs being passed in <strong>content_ids</strong> or <strong>contents</strong> parameter are IDs of products then the value should be <strong>product</strong>. If product group IDs are being passed, then the value should be <strong>product_group</strong>.""","This option shoud be set to ""No"".<br />There is only one scenario when this option should be set to ""Yes"". That is when you select <strong>Product SKU</strong> for option <strong>For Grouped Products Use</strong>. Regarding <strong>content_type</strong> read this from Facebook documentation: ""If the IDs being passed in <strong>content_ids</strong> or <strong>contents</strong> parameter are IDs of products then the value should be <strong>product</strong>. If product group IDs are being passed, then the value should be <strong>product_group</strong>."""
"For Simple Products Use","For Simple Products Use"
"Select SKU you want to use for simple products. See the tooltip.","Select SKU you want to use for simple products. See the tooltip."
"For Virtual Products Use","For Virtual Products Use"
"Select SKU you want to use for virtual products. See the tooltip.","Select SKU you want to use for virtual products. See the tooltip."
"Use content_ids instead of contents","Use content_ids instead of contents"
"Use <strong>content_ids</strong> instead of <strong>contents</strong> for <strong>ViewContent</strong> event. <strong>See the tooltip.</strong>","Use <strong>content_ids</strong> instead of <strong>contents</strong> for <strong>ViewContent</strong> event. <strong>See the tooltip.</strong>"
"It is recommended to set this option to ""No"". The <strong>contents</strong> parameter is required for <strong>AddToCart</strong> and <strong>Purchase</strong> events. The <strong>ViewContent</strong> event can use <strong>contents</strong> or <strong>content_ids</strong> parameter. It is better to use <strong>contents</strong> but you can use <strong>content_ids</strong> if you want.","It is recommended to set this option to ""No"". The <strong>contents</strong> parameter is required for <strong>AddToCart</strong> and <strong>Purchase</strong> events. The <strong>ViewContent</strong> event can use <strong>contents</strong> or <strong>content_ids</strong> parameter. It is better to use <strong>contents</strong> but you can use <strong>content_ids</strong> if you want."
"For Global content_name Use","For Global content_name Use"
"Type Magento <strong>product attribute</strong> code you want to use for product global <strong>content_name</strong> field.","Type Magento <strong>product attribute</strong> code you want to use for product global <strong>content_name</strong> field."
"Example: name<br />Make sure all of your products have this attribute and all of your products have non-empty value for this attribute.<br />This option is for setting <strong>content_name</strong> outside <strong>contents</strong>. If you want to set <strong>content_name</strong> inside <strong>contents</strong> per each item then use <strong>Product Parameters to Attributes Mapping</strong> option and set this option to empty.","Example: name<br />Make sure all of your products have this attribute and all of your products have non-empty value for this attribute.<br />This option is for setting <strong>content_name</strong> outside <strong>contents</strong>. If you want to set <strong>content_name</strong> inside <strong>contents</strong> per each item then use <strong>Product Parameters to Attributes Mapping</strong> option and set this option to empty."
"For Global content_category Use","For Global content_category Use"
"Type Magento <strong>product attribute</strong> code you want to use for product global <strong>content_category</strong> field.","Type Magento <strong>product attribute</strong> code you want to use for product global <strong>content_category</strong> field."
"Example: product_category<br />Make sure all of your products have this attribute and all of your products have non-empty value for this attribute.<br />This option is for setting <strong>content_category</strong> outside <strong>contents</strong>. If you want to set <strong>content_category</strong> inside <strong>contents</strong> per each item then use <strong>Product Parameters to Attributes Mapping</strong> option and set this option to empty.","Example: product_category<br />Make sure all of your products have this attribute and all of your products have non-empty value for this attribute.<br />This option is for setting <strong>content_category</strong> outside <strong>contents</strong>. If you want to set <strong>content_category</strong> inside <strong>contents</strong> per each item then use <strong>Product Parameters to Attributes Mapping</strong> option and set this option to empty."
"For Global google_product_category Use","For Global google_product_category Use"
"Type Magento <strong>product attribute</strong> code you want to use for product global <strong>google_product_category</strong> field.","Type Magento <strong>product attribute</strong> code you want to use for product global <strong>google_product_category</strong> field."
"Example: google_product_category<br />Make sure all of your products have this attribute and all of your products have non-empty value for this attribute.<br />This option is for setting <strong>google_product_category</strong> outside <strong>contents</strong>. If you want to set <strong>google_product_category</strong> inside <strong>contents</strong> per each item then use <strong>Product Parameters to Attributes Mapping</strong> option and set this option to empty.","Example: google_product_category<br />Make sure all of your products have this attribute and all of your products have non-empty value for this attribute.<br />This option is for setting <strong>google_product_category</strong> outside <strong>contents</strong>. If you want to set <strong>google_product_category</strong> inside <strong>contents</strong> per each item then use <strong>Product Parameters to Attributes Mapping</strong> option and set this option to empty."
"Product Parameters to Attributes Mapping","Product Parameters to Attributes Mapping"
"If you want to add custom parameters to products. <strong>WARNING! Please see the tooltip.</strong>","If you want to add custom parameters to products. <strong>WARNING! Please see the tooltip.</strong>"
"This option depends on <strong>Move Parameters Outside Contents</strong> option. If this option is enabled the parameters will be moved outside contents or removed if contents have more than one item.<br />Example: gpc=gpc|color=color<br />As you can see the format is simple<br /><strong>param1=attribute1|param2=attribute2</strong><br /> Facebook Pixel parameter and Magento product attribute are connected by = sign and pairs are separated by | sign.","This option depends on <strong>Move Parameters Outside Contents</strong> option. If this option is enabled the parameters will be moved outside contents or removed if contents have more than one item.<br />Example: gpc=gpc|color=color<br />As you can see the format is simple<br /><strong>param1=attribute1|param2=attribute2</strong><br /> Facebook Pixel parameter and Magento product attribute are connected by = sign and pairs are separated by | sign."
"Quote (Checkout Page - InitiateCheckout Event)","Quote (Checkout Page - InitiateCheckout Event)"
"Add Quote-Related Code To","Add Quote-Related Code To"
"Type page handles (full action names) where you want quote-related code. <strong>See the tooltip.</strong>","Type page handles (full action names) where you want quote-related code. <strong>See the tooltip.</strong>"
"The page handles - Synonyms of the page type identifiers. Correspond to ""full action names"" of controller actions, for example, checkout_index_index<br />In this option you would type all handles where you want to add quote-related code.<br /><strong>This option only works for checkout page handles where quote object is set.</strong>","The page handles - Synonyms of the page type identifiers. Correspond to ""full action names"" of controller actions, for example, checkout_index_index<br />In this option you would type all handles where you want to add quote-related code.<br /><strong>This option only works for checkout page handles where quote object is set.</strong>"
"Examples with <strong>contents</strong>:<br /><br /><strong>Product SKU</strong><br />contents: [<br />{id: 'SHBP', quantity: 1}<br />]<br /><br /><strong>Child SKU</strong><br />contents: [<br />{id: 'SHBP-7-BL', quantity: 1}<br />]<br /><br /><strong>Child SKU and Product SKU</strong><br />contents: [<br />{id: 'SHBP-7-BL', item_group_id: 'SHBP', quantity: 1}<br />]<br /><br/ >Examples with <strong>content_ids</strong>:<br /><br /><strong>Product SKU</strong><br />content_ids: ['SHBP']<br /><br /><strong>Child SKU</strong><br />content_ids: ['SHBP-7-BL']<br /><br /><strong>Child SKU and Product SKU</strong><br />content_ids: ['SHBP-7-BL'],<br />item_group_id: 'SHBP'","Examples with <strong>contents</strong>:<br /><br /><strong>Product SKU</strong><br />contents: [<br />{id: 'SHBP', quantity: 1}<br />]<br /><br /><strong>Child SKU</strong><br />contents: [<br />{id: 'SHBP-7-BL', quantity: 1}<br />]<br /><br /><strong>Child SKU and Product SKU</strong><br />contents: [<br />{id: 'SHBP-7-BL', item_group_id: 'SHBP', quantity: 1}<br />]<br /><br/ >Examples with <strong>content_ids</strong>:<br /><br /><strong>Product SKU</strong><br />content_ids: ['SHBP']<br /><br /><strong>Child SKU</strong><br />content_ids: ['SHBP-7-BL']<br /><br /><strong>Child SKU and Product SKU</strong><br />content_ids: ['SHBP-7-BL'],<br />item_group_id: 'SHBP'"
"Examples with <strong>contents</strong>:<br /><br /><strong>Children SKUs</strong><br />contents: [<br />{id: 'SHBP-6-BL', quantity: 1},<br />{id: 'SHBP-7-BL', quantity: 1},<br />{id: 'SHBP-8-BL', quantity: 1}<br />]<br /><br /><strong>Children SKUs and Product SKU</strong><br />contents: [<br />{id: 'SHBP-6-BL', item_group_id: 'SHBP', quantity: 1},<br />{id: 'SHBP-7-BL', item_group_id: 'SHBP', quantity: 1},<br />{id: 'SHBP-8-BL', item_group_id: 'SHBP', quantity: 1}<br />]<br /><br/ >Examples with <strong>content_ids</strong>:<br /><br /><strong>Children SKUs</strong><br />content_ids: ['SHBP-6-BL', 'SHBP-7-BL', 'SHBP-8-BL']<br /><br /><strong>Children SKUs and Product SKU</strong><br />content_ids: ['SHBP-6-BL', 'SHBP-7-BL', 'SHBP-8-BL'],<br />item_group_id: 'SHBP'<br /><br />There is no option for <strong>Product SKU</strong> and that is intentional. From Magento documentation: ""Although they are presented as a group, each product in the group is purchased as a separate item. In the shopping cart, each item and the quantity purchased appears as a separate line item.""","Examples with <strong>contents</strong>:<br /><br /><strong>Children SKUs</strong><br />contents: [<br />{id: 'SHBP-6-BL', quantity: 1},<br />{id: 'SHBP-7-BL', quantity: 1},<br />{id: 'SHBP-8-BL', quantity: 1}<br />]<br /><br /><strong>Children SKUs and Product SKU</strong><br />contents: [<br />{id: 'SHBP-6-BL', item_group_id: 'SHBP', quantity: 1},<br />{id: 'SHBP-7-BL', item_group_id: 'SHBP', quantity: 1},<br />{id: 'SHBP-8-BL', item_group_id: 'SHBP', quantity: 1}<br />]<br /><br/ >Examples with <strong>content_ids</strong>:<br /><br /><strong>Children SKUs</strong><br />content_ids: ['SHBP-6-BL', 'SHBP-7-BL', 'SHBP-8-BL']<br /><br /><strong>Children SKUs and Product SKU</strong><br />content_ids: ['SHBP-6-BL', 'SHBP-7-BL', 'SHBP-8-BL'],<br />item_group_id: 'SHBP'<br /><br />There is no option for <strong>Product SKU</strong> and that is intentional. From Magento documentation: ""Although they are presented as a group, each product in the group is purchased as a separate item. In the shopping cart, each item and the quantity purchased appears as a separate line item."""
"Use Magento Quote ID For Parameter","Use Magento Quote ID For Parameter"
"Type parameter name for which you want to use Magento quote ID. Example: <strong>quote_id</strong>","Type parameter name for which you want to use Magento quote ID. Example: <strong>quote_id</strong>"
"Magento quote ID is internal database table auto increment ID.<br />Example: <strong>3275</strong><br /><br /><strong>If you do not want to use parameter for Magento quote ID leave this field empty.</strong>","Magento quote ID is internal database table auto increment ID.<br />Example: <strong>3275</strong><br /><br /><strong>If you do not want to use parameter for Magento quote ID leave this field empty.</strong>"
"If you want to add custom parameters to products. <strong>WARNING! Please see a tooltip.</strong>","If you want to add custom parameters to products. <strong>WARNING! Please see a tooltip.</strong>"
"Order (Checkout Success Page - Purchase Event)","Order (Checkout Success Page - Purchase Event)"
"Add Order-Related Code To","Add Order-Related Code To"
"Type page handles (full action names) where you want order-related code. <strong>See the tooltip.</strong>","Type page handles (full action names) where you want order-related code. <strong>See the tooltip.</strong>"
"The page handles - Synonyms of the page type identifiers. Correspond to ""full action names"" of controller actions, for example, checkout_onepage_success<br />In this option you would type all handles where you want to add order-related code.<br /><strong>This option only works for checkout success page handles where order object is set.</strong>","The page handles - Synonyms of the page type identifiers. Correspond to ""full action names"" of controller actions, for example, checkout_onepage_success<br />In this option you would type all handles where you want to add order-related code.<br /><strong>This option only works for checkout success page handles where order object is set.</strong>"
"Use Magento Order ID For Parameter","Use Magento Order ID For Parameter"
"Type parameter name for which you want to use Magento order ID. Example: <strong>order_id</strong>","Type parameter name for which you want to use Magento order ID. Example: <strong>order_id</strong>"
"Magento order ID is internal database table auto increment ID.<br />Example: <strong>2543</strong><br /><br /><strong>If you do not want to use parameter for Magento order ID leave this field empty.</strong>","Magento order ID is internal database table auto increment ID.<br />Example: <strong>2543</strong><br /><br /><strong>If you do not want to use parameter for Magento order ID leave this field empty.</strong>"
"Use Magento Order Increment ID For Parameter","Use Magento Order Increment ID For Parameter"
"Type parameter name for which you want to use Magento order increment ID. Example: <strong>order_id</strong>","Type parameter name for which you want to use Magento order increment ID. Example: <strong>order_id</strong>"
"Magento order increment ID is what you see in order emails, Magento Admin and which you communicate to your customer.<br />Example: <strong>000001586</strong><br /><br /><strong>If you do not want to use parameter for Magento order increment ID leave this field empty.</strong>","Magento order increment ID is what you see in order emails, Magento Admin and which you communicate to your customer.<br />Example: <strong>000001586</strong><br /><br /><strong>If you do not want to use parameter for Magento order increment ID leave this field empty.</strong>"
"Search (Search Result Page - Search Event)","Search (Search Result Page - Search Event)"
"Add Search-Related Code To","Add Search-Related Code To"
"Type page handles (full action names) where you want search-related code. <strong>See the tooltip.</strong>","Type page handles (full action names) where you want search-related code. <strong>See the tooltip.</strong>"
"The page handles - Synonyms of the page type identifiers. Correspond to ""full action names"" of controller actions, for example, catalogsearch_result_index<br />In this option you would type all handles where you want to add search-related code.","The page handles - Synonyms of the page type identifiers. Correspond to ""full action names"" of controller actions, for example, catalogsearch_result_index<br />In this option you would type all handles where you want to add search-related code."
"Type <strong>event name</strong> you want to use for search tracking. See the tooltip.","Type <strong>event name</strong> you want to use for search tracking. See the tooltip."
"The proper event name is <strong>Search</strong>.","The proper event name is <strong>Search</strong>."
"Parameter Name","Parameter Name"
"Type <strong>parameter name</strong> you want to use for search tracking. See the tooltip.","Type <strong>parameter name</strong> you want to use for search tracking. See the tooltip."
"The proper parameter name is <strong>search_string</strong>.","The proper parameter name is <strong>search_string</strong>."
"Request Parameters","Request Parameters"
"Type <strong>request parameters</strong> you want to include for search tracking. See the tooltip.","Type <strong>request parameters</strong> you want to include for search tracking. See the tooltip."
"Example: <strong>q,name,sku,description,<br />short_description</strong>.<br />If only <strong>q</strong> request parameter exists then only its value will be used. If multiple request parameters exist their values will be concatenated with a comma sign in between.","Example: <strong>q,name,sku,description,<br />short_description</strong>.<br />If only <strong>q</strong> request parameter exists then only its value will be used. If multiple request parameters exist their values will be concatenated with a comma sign in between."
"The Access Token is not valid.","The Access Token is not valid."
"The API Version is not valid.","The API Version is not valid."
"The content_category attribute code is not valid.","The content_category attribute code is not valid."
"The content_name attribute code is not valid.","The content_name attribute code is not valid."
"The Event Name is not valid.","The Event Name is not valid."
"The google_product_category attribute code is not valid.","The google_product_category attribute code is not valid."
"Handles list is not valid.","Handles list is not valid."
"Product SKU as (id)","Product SKU as (id)"
"Product SKU as (id) and Parent SKU as (item_group_id)","Product SKU as (id) and Parent SKU as (item_group_id)"
"Children SKUs as (id)s","Children SKUs as (id)s"
"Children SKUs as (id)s and Product SKU as (item_group_id)","Children SKUs as (id)s and Product SKU as (item_group_id)"
"Product SKU as (id) (Not Recommended)","Product SKU as (id) (Not Recommended)"
"Child SKU as (id)","Child SKU as (id)"
"Child SKU as (id) and Product SKU as (item_group_id)","Child SKU as (id) and Product SKU as (item_group_id)"
"Product Parameters to Attributes Mapping is not valid.","Product Parameters to Attributes Mapping is not valid."
"The parameter name for Magento order ID is not valid.","The parameter name for Magento order ID is not valid."
"The parameter name for Magento order increment ID is not valid.","The parameter name for Magento order increment ID is not valid."
"The parameter name is not valid.","The parameter name is not valid."
"Please correct Facebook Pixel ID: ""%1"".","Please correct Facebook Pixel ID: ""%1""."
"The parameter name for Magento quote ID is not valid.","The parameter name for Magento quote ID is not valid."
"The request parameters option is not valid.","The request parameters option is not valid."
"The Test Event Code is not valid.","The Test Event Code is not valid."
